{
  "$schema": "http://json-schema.org/draft-07/schema#",
  "$id": "urn:agent-task:0.1:result-manifest",
  "type": "object",
  "additionalProperties": false,
  "required": [
    "protocol",
    "settlementChainId",
    "taskManager",
    "taskId",
    "attempt",
    "worker",
    "specHash",
    "output",
    "artifacts",
    "provenance"
  ],
  "properties": {
    "protocol": {
      "const": "agent-task/0.1"
    },
    "settlementChainId": {
      "type": "string",
      "pattern": "^[1-9][0-9]*$",
      "maxLength": 78
    },
    "taskManager": {
      "type": "string",
      "pattern": "^0x[0-9a-f]{40}$",
      "not": {
        "const": "0x0000000000000000000000000000000000000000"
      }
    },
    "taskId": {
      "type": "string",
      "pattern": "^[1-9][0-9]*$",
      "maxLength": 78
    },
    "attempt": {
      "type": "string",
      "pattern": "^[1-9][0-9]*$",
      "maxLength": 78
    },
    "worker": {
      "type": "string",
      "pattern": "^0x[0-9a-f]{40}$",
      "not": {
        "const": "0x0000000000000000000000000000000000000000"
      }
    },
    "specHash": {
      "type": "string",
      "pattern": "^0x[0-9a-f]{64}$",
      "not": {
        "const": "0x0000000000000000000000000000000000000000000000000000000000000000"
      }
    },
    "output": {},
    "artifacts": {
      "type": "array",
      "maxItems": 16,
      "items": {
        "type": "object",
        "additionalProperties": false,
        "required": [
          "uri",
          "hash",
          "mediaType",
          "sizeBytes"
        ],
        "properties": {
          "uri": {
            "type": "string",
            "minLength": 1,
            "maxLength": 512,
            "pattern": "^(https://|ipfs://|http://localhost[:/]|http://127\\.0\\.0\\.1[:/])"
          },
          "hash": {
            "type": "string",
            "pattern": "^0x[0-9a-f]{64}$",
            "not": {
              "const": "0x0000000000000000000000000000000000000000000000000000000000000000"
            }
          },
          "mediaType": {
            "type": "string",
            "minLength": 1,
            "maxLength": 4096
          },
          "sizeBytes": {
            "type": "integer",
            "minimum": 0,
            "maximum": 5242880
          }
        }
      }
    },
    "provenance": {
      "type": "object",
      "additionalProperties": false,
      "properties": {
        "sourceChainId": {
          "type": "string",
          "pattern": "^[1-9][0-9]*$",
          "maxLength": 78
        },
        "blockRange": {
          "type": "object",
          "additionalProperties": false,
          "required": [
            "fromBlock",
            "toBlock",
            "toBlockHash"
          ],
          "properties": {
            "fromBlock": {
              "type": "string",
              "pattern": "^(0|[1-9][0-9]*)$",
              "maxLength": 78
            },
            "toBlock": {
              "type": "string",
              "pattern": "^(0|[1-9][0-9]*)$",
              "maxLength": 78
            },
            "toBlockHash": {
              "type": "string",
              "pattern": "^0x[0-9a-f]{64}$",
              "not": {
                "const": "0x0000000000000000000000000000000000000000000000000000000000000000"
              }
            }
          }
        },
        "sources": {
          "type": "array",
          "maxItems": 64,
          "items": {
            "type": "object",
            "additionalProperties": false,
            "required": [
              "uri",
              "retrievedAt"
            ],
            "properties": {
              "uri": {
                "type": "string",
                "minLength": 1,
                "maxLength": 512,
                "pattern": "^(https://|ipfs://|http://localhost[:/]|http://127\\.0\\.0\\.1[:/])"
              },
              "retrievedAt": {
                "type": "integer",
                "minimum": 0,
                "maximum": 9007199254740991
              },
              "contentHash": {
                "type": "string",
                "pattern": "^0x[0-9a-f]{64}$",
                "not": {
                  "const": "0x0000000000000000000000000000000000000000000000000000000000000000"
                }
              }
            }
          }
        },
        "toolVersion": {
          "type": "string",
          "minLength": 1,
          "maxLength": 4096
        }
      }
    },
    "agentRef": {
      "type": "object",
      "additionalProperties": false,
      "required": [
        "chainId",
        "registry",
        "agentId"
      ],
      "properties": {
        "chainId": {
          "type": "string",
          "pattern": "^[1-9][0-9]*$",
          "maxLength": 78
        },
        "registry": {
          "type": "string",
          "pattern": "^0x[0-9a-f]{40}$",
          "not": {
            "const": "0x0000000000000000000000000000000000000000"
          }
        },
        "agentId": {
          "type": "string",
          "pattern": "^(0|[1-9][0-9]*)$",
          "maxLength": 78
        }
      }
    }
  }
}
